{
  "$id": "urn:ratatoskr:contracts:events:v1:KnowledgeChannelDigestRecapCompleted",
  "$schema": "https://json-schema.org/draft/2020-12/schema",
  "title": "KnowledgeChannelDigestRecapCompleted",
  "description": "Payload of `knowledge.channel_digest_recap.completed.v1`.",
  "type": "object",
  "properties": {
    "analysis_ref": {
      "description": "Stable Knowledge analysis reference.",
      "$ref": "#/$defs/KnowledgeAnalysisRef"
    },
    "completed_at": {
      "description": "Knowledge-asserted durable completion instant.",
      "$ref": "#/$defs/WireTimestamp"
    },
    "coverage": {
      "description": "Exact selected/included/omitted source coverage.",
      "$ref": "#/$defs/ChannelDigestRecapCoverage"
    },
    "digest_result_id": {
      "description": "Stable identity of the durable result projection.",
      "$ref": "#/$defs/ChannelDigestResultId"
    },
    "digest_run_id": {
      "description": "Stable digest run identity.",
      "$ref": "#/$defs/ChannelDigestRunId"
    },
    "manifest_digest": {
      "description": "Digest of the exact source manifest analyzed.",
      "$ref": "#/$defs/ContentDigest"
    },
    "operation_id": {
      "description": "Platform operation owning this recap.",
      "$ref": "#/$defs/OperationId"
    },
    "owner": {
      "description": "Authenticated internal user owner.",
      "$ref": "#/$defs/TenantRef"
    },
    "result_digest": {
      "description": "SHA-256 identity of the canonical result projection bytes.",
      "$ref": "#/$defs/ContentDigest"
    },
    "result_ref": {
      "description": "Owner-authorized pointer to that result projection.",
      "$ref": "#/$defs/ChannelDigestResultRef"
    }
  },
  "additionalProperties": true,
  "required": [
    "analysis_ref",
    "completed_at",
    "coverage",
    "digest_result_id",
    "digest_run_id",
    "manifest_digest",
    "operation_id",
    "owner",
    "result_digest",
    "result_ref"
  ],
  "x-ratatoskr-provenance": {
    "canonical_source": "ratatoskr_channel_digest_contracts::KnowledgeChannelDigestRecapCompleted",
    "contract_id": "knowledge.channel_digest_recap_completed",
    "contract_major_version": 1,
    "generated": "DO NOT EDIT — generated by contractsc from the canonical Rust source. Change the Rust type and run `cargo contracts generate`.",
    "generator": "contractsc",
    "generator_version": "0.1.0",
    "schemars_version": "1.2.2",
    "source_digest": "sha256:496ea4f26564670e9d63e361b75b0aaf3f28d029e73debf334842f2199a5e367",
    "validation_note": "This schema is a LOWER BOUND on validity. Cross-field invariants and canonical-form rules are enforced by the canonical Rust type; see fixtures/invalid-expectations.toml for which layer rejects what."
  },
  "x-ratatoskr-unknown-policy": "preserve",
  "$defs": {
    "ChannelDigestRecapCoverage": {
      "description": "Exact source coverage reported by one successful recap.",
      "type": "object",
      "properties": {
        "channel_count": {
          "description": "Public channels represented by the included sources.",
          "$ref": "#/$defs/DigestChannelCount"
        },
        "included_count": {
          "description": "Complete source revisions included in provider context.",
          "type": "integer",
          "format": "uint16",
          "maximum": 65535,
          "minimum": 0
        },
        "omitted_count": {
          "description": "Complete source revisions omitted under the context budget.",
          "type": "integer",
          "format": "uint16",
          "maximum": 65535,
          "minimum": 0
        },
        "selected_count": {
          "description": "Verified source revisions selected from the manifest.",
          "$ref": "#/$defs/DigestSourceCount"
        }
      },
      "required": [
        "channel_count",
        "included_count",
        "omitted_count",
        "selected_count"
      ]
    },
    "ChannelDigestResultId": {
      "title": "ChannelDigestResultId",
      "description": "Canonical channel-digest UUID identity.",
      "type": "string",
      "format": "uuid",
      "pattern": "^[0-9a-f]{8}-[0-9a-f]{4}-[0-9a-f]{4}-[0-9a-f]{4}-[0-9a-f]{12}$"
    },
    "ChannelDigestResultRef": {
      "title": "ChannelDigestResultRef",
      "description": "Owner-authorized digest-result projection reference; never recap content.",
      "type": "string",
      "examples": [
        "channel-digest-result:018f0000-0000-7000-8000-000000000003"
      ],
      "maxLength": 58,
      "pattern": "^channel-digest-result:[0-9a-f]{8}-[0-9a-f]{4}-[0-9a-f]{4}-[0-9a-f]{4}-[0-9a-f]{12}$"
    },
    "ChannelDigestRunId": {
      "title": "ChannelDigestRunId",
      "description": "Canonical channel-digest UUID identity.",
      "type": "string",
      "format": "uuid",
      "pattern": "^[0-9a-f]{8}-[0-9a-f]{4}-[0-9a-f]{4}-[0-9a-f]{4}-[0-9a-f]{12}$"
    },
    "ContentDigest": {
      "description": "A content digest with an explicit algorithm.",
      "type": "object",
      "properties": {
        "algorithm": {
          "description": "Hash algorithm used to produce `hex`.",
          "$ref": "#/$defs/DigestAlgorithm"
        },
        "hex": {
          "description": "Lowercase hexadecimal digest bytes.",
          "$ref": "#/$defs/DigestHex"
        }
      },
      "additionalProperties": false,
      "required": [
        "algorithm",
        "hex"
      ]
    },
    "DigestAlgorithm": {
      "description": "Algorithm used to calculate a content digest.",
      "oneOf": [
        {
          "description": "SHA-256.",
          "type": "string",
          "const": "sha256"
        }
      ]
    },
    "DigestChannelCount": {
      "title": "DigestChannelCount",
      "description": "Positive bounded channel-digest count.",
      "type": "integer",
      "maximum": 20,
      "minimum": 1
    },
    "DigestHex": {
      "title": "DigestHex",
      "description": "Lowercase hexadecimal bytes of a content digest.",
      "type": "string",
      "examples": [
        "0000000000000000000000000000000000000000000000000000000000000000"
      ],
      "maxLength": 64,
      "pattern": "^[0-9a-f]{64}$"
    },
    "DigestSourceCount": {
      "title": "DigestSourceCount",
      "description": "Positive bounded channel-digest count.",
      "type": "integer",
      "maximum": 100,
      "minimum": 1
    },
    "KnowledgeAnalysisRef": {
      "title": "KnowledgeAnalysisRef",
      "description": "Stable Knowledge analysis reference linked to a digest recap.",
      "type": "string",
      "examples": [
        "analysis:018f0000-0000-7000-8000-000000000004"
      ],
      "maxLength": 45,
      "pattern": "^analysis:[0-9a-f]{8}-[0-9a-f]{4}-[0-9a-f]{4}-[0-9a-f]{4}-[0-9a-f]{12}$"
    },
    "OperationId": {
      "title": "OperationId",
      "description": "Identity of one long-running operation, stable for its whole lifecycle. Bare canonical lowercase hyphenated UUID; not namespaced.",
      "type": "string",
      "format": "uuid",
      "examples": [
        "018f0000-0000-7000-8000-000000000001"
      ],
      "pattern": "^[0-9a-f]{8}-[0-9a-f]{4}-[0-9a-f]{4}-[0-9a-f]{4}-[0-9a-f]{12}$"
    },
    "TenantRef": {
      "title": "TenantRef",
      "description": "The owner of the data a record concerns, wire form `user:<uuid>`. The kind set is closed: a consumer that cannot understand the owner kind must reject the record rather than process it.",
      "type": "string",
      "examples": [
        "user:018f0000-0000-7000-8000-000000000005"
      ],
      "maxLength": 41,
      "pattern": "^user:[0-9a-f]{8}-[0-9a-f]{4}-[0-9a-f]{4}-[0-9a-f]{4}-[0-9a-f]{12}$"
    },
    "WireTimestamp": {
      "title": "WireTimestamp",
      "description": "An instant on the wire: RFC 3339 in UTC with the literal `Z` designator. Exactly one spelling is accepted per instant — an input that does not re-render to itself is rejected. The field holding it declares the clock authority.",
      "type": "string",
      "format": "date-time",
      "examples": [
        "2026-08-17T10:00:00Z"
      ],
      "pattern": "^\\d{4}-\\d{2}-\\d{2}T\\d{2}:\\d{2}:\\d{2}(\\.\\d{1,9})?Z$"
    }
  }
}
